date_documented,date,time,described_duration,described_ufo,full_description,city,state,latitude,longitude
11/2/1999,10/10/1995,07:45 pm,2 min.,,"man  on hwy 43 sw of milwaukee sees large, bright blue light streak by his car, descend, turn, cross road ahead, strobe. bizarre!",milwaukee,wi,43.0388889,-87.9063889
11/2/1999,10/10/1995,10:40 pm,1 minute,,"woman repts.  bright light in nw sky, suddenly approaches her, flies slowly overhead.  swept wings, 2 blurry lights either side.",oakland,ca,37.8044444,-122.2697222
11/2/1999,10/11/1995,06:30 pm,12 min.,,"young man, mother witness watch strange red obj. 45 deg. above horizon w/ binocular.  obj. suddenly fades, disappears from sight.",new york city,ny,40.7141667,-74.0063889
11/2/1999,10/11/1995,08:00 pm,2 min.,,"young man &amp  grandfather see a ""large, orange, round or oval"" obj. move along horizon very fast, hover, move erratically.  bizarre!",huntington,wv,38.4191667,-82.4452778
10/31/2003,10/11/2003,12:00 am,2 days?,,lost two days awaken to power out tv fried and blood from ear.disoriented,san diego,ca,32.7152778,-117.1563889
10/19/2011,10/11/2011,09:00 pm,5 min.,,"orange light formation over monroe, ct 10/11/11--hangs in sky then flys away.",monroe,ct,41.3325,-73.2077778
2/18/2001,10/1/1987,01:00 am,one hour,,"an ""out of the body"" experience",west palm beach,fl,26.7052778,-80.0366667
11/2/1999,10/1/1995,12:00 pm,20 sec.,,"man witnesses 2 ""white"" aircraft rendezvous at high altitude, fly toward bizarre obj. approaching very fast.  obj. ""sparkled.""",iowa city,ia,41.6611111,-91.53
11/2/1999,10/1/1995,02:00 pm,5 sec.,,man reports brief sighting of peculiar white object in daytime sky.  (see later sighting on same day.),lake oswego,or,45.4208333,-122.6694444
11/2/1999,10/1/1995,04:30 pm,90 sec.,,"man reports witnessing 2 ""diamond-shaped objects overhead. (second sighting on same day.)",lake oswego,or,45.4208333,-122.6694444
11/2/1999,10/1/1995,10:30 pm,90 min.,,"man reports wife went out to empty trash, disappears for 90 min., returns disoriented and acting strangely.",austin,tx,30.2669444,-97.7427778
10/12/2001,10/1/2001,01:05 am,1 sec,,just a meteor sighting...,seattle,wa,47.6063889,-122.3308333
10/30/2006,10/1/2006,07:48 pm,3-4 seconds,,white quickly moving light swept across our backyard.,austin,tx,30.2669444,-97.7427778
10/30/2006,10/1/2006,11:00 pm,60 seconds,,there appeared to be about six very very bright glowing white ball shaped objects.,cuchara,co,37.3791667,-105.0997222
11/28/2007,10/12/2007,10:00 pm,10 min,,lights in irvine october 2007: hoax,irvine,ca,33.6694444,-117.8222222
10/30/2012,10/12/2012,07:00 pm,45 seconds,,2 objects with flame trails  making manuevers spirals lights,glendale,az,33.5386111,-112.1852778
10/30/2012,10/12/2012,08:28 pm,2 minutes,,observed a round ball of white light about 1000 ft next to a plane going same speed then disappear.,bellevue,ky,39.1063889,-84.4788889
11/2/1999,10/13/1995,05:50 am,10 min.,,"woman goes outside to retrieve paper, sees ""some lights"" hovering above ocean.  white lights turn red, begin zigzagging, stopped.",crescent city,ca,41.7561111,-124.2005556
11/2/1999,10/13/1995,08:00 pm,3 min.,,"woman repts. 5-6 ""rocket ship-shaped things, w/sparks flying out back end,"" flying down vert.out of the night sky. good rept.",tacoma,wa,47.2530556,-122.4430556
10/31/2008,10/13/2008,09:30 pm,1 hour,,40-50 lights flying over butte montana in a v formation,butte,mt,46.0038889,-112.5338889
11/11/2013,10/13/2013,10:50 am,10 minutes,,"((hoax??))  some kind of aircraft with a huge wingspan was flying very low over my neighborhood in santa fe, nm.",santa fe,nm,35.6869444,-105.9372222
8/30/1999,10/14/1965,09:00 pm,brief-15sec,,"suddenly a brilliant white light lit up the entire country side.  brighter than the sun. i guess around a 1,000 feet above ground, coul",ponca city,ok,36.7069444,-97.0852778
11/21/2010,10/14/1974,08:00 pm,15 seconds,,"saw triangle shaped craft, light on each corner, low overhead, few hundred feet above.  as craft went by saw light on top. soft noise l",oran,mo,37.085,-89.6552778
11/2/1999,10/14/1995,01:25 pm,2 min.,,"man repts.""long silver obj., seemed to roll, alternated from silver to gray.""  had a ""red glow"" near tail, released gold/yellow sparks.",des moines,wa,47.4019444,-122.3230556
11/2/1999,10/14/1995,10:30 pm,5 sec.,,"several young people witness ""lime-green, glowing sphere"" descend from w to e in n sky, disappear below hor.  other repts.",dayton,wa,46.3238889,-117.9713889
11/2/1999,10/14/1995,10:30 pm,6 min.,,"co. emerg. dispatch relays sighting of ""pointed, oval obj."" by family of 4.  when bright light dimmed, ""spikes sticking out"" visible.",madison,wi,43.0730556,-89.4011111
11/2/1999,10/14/1995,10:30 pm,20 sec.,,"man calls to report multiple witnesses to ""green fireball"" over wa, id, mt.  very strange object!",sandpoint,id,48.2766667,-116.5522222
11/2/1999,10/14/1995,10:30 pm,20 sec.,,empl. of krem-tv calls regarding multiple sightings of bright green object w/ orange tail reported by multiple callers.,spokane,wa,47.6588889,-117.425
11/2/1999,10/14/1995,10:30 pm,2 sec.,,"two women witness green obj, ""size of full moon,"" fly directly toward them, descend from se.  illuminated trees on top of mtn..",troy,mt,48.4633333,-115.8886111
10/15/2002,10/14/2002,07:00 pm,several minutes,,bright white round light with wide fanned tail flying slowly north then suddenly disappearing  ((vandenberg rocket launch.  pd)),vancouver,wa,45.6388889,-122.6602778
3/21/2003,10/15/1957,02:00 am,2x3 hrs,,tall unidentified being enters home - n.y.c. 1957,new york city,ny,40.7141667,-74.0063889
11/2/1999,10/15/1994,04:25 pm,25 min.,,"former mil. officer (ret.) w/ son &amp  4 others witnessed a very bright obj. in cloudless blue sky.  alternated silver, black, then white.",bellevue,wa,47.6105556,-122.1994444
11/2/1999,10/15/1995,06:15 pm,40 min,,"man &amp  2 sons witness, pursue in car, strange obj. in rural area. was size, approx. color of moon. odd shape, haze. ""winked out.""",godfrey,il,38.9555556,-90.1866667
2/22/2002,10/15/1995,10:15 pm,5 seconds,,"young couple witness large glowing craft streak across the night sky, as if it were ""exiting"" the earth. craft was followed by a trail",woodstock,ct,41.9483333,-71.9744444
12/5/2001,10/15/2000,03:30 pm,2 hrs.,,both of these little people had long arms and big black eyes. they were shorter then me. their heads were bigger then their body and ca,del valle,tx,30.2105556,-97.6544444
3/10/2011,10/15/2010,02:00 am,10 mintues,,light  when i took picture i see object in pic disk,western springs,il,41.8097222,-87.9005556
10/20/2005,10/16/2005,07:48 pm,1 minute,,"experienced observer witnesses a strange, amorphous, unlighted object streak across the sky, stop, and then simply disappear.",santa maria,ca,34.9530556,-120.4347222
11/2/1999,10/17/1995,09:38 pm,5 min.,,"man witnesses strange white, oval-shaped light being pursued by 2 fast aircraft.  very high, fast.  obj dramatically outpaced a/c.",crescent city,ca,41.7561111,-124.2005556
10/20/2005,10/17/2005,01:40 am,1 minute,,"two adults witness peculiar yellow flare, which suddenly accelerates and streaks away.",arlington,tx,32.7355556,-97.1077778
11/2/1999,10/18/1995,06:45 pm,1 minute,,"man &amp  wife witness ""large white luminous ball w/ bright blue tail"" descend from w to e in n sky.  moved very rapidly.  good rpt.",grass lake,mi,42.2508333,-84.2130556
7/23/2000,10/18/1999,03:00 am,5-6 min,,other happneings other than ufo's,latrobe,pa,40.3211111,-79.3797222
11/21/2010,10/18/2010,07:30 am,10 seconds,,"a possible disk shaped object is seen over honeoye falls, ny.",honeoye falls,ny,42.9522222,-77.5905556
11/2/1999,10/19/1995,05:30 am,1 minute,,"woman repts. being awakened by strange ""whine, like a jet.""  went outside, saw bizarre delta-shaped craft. obj. changed shape!",rocky point,wa,47.5930556,-122.6672222
11/2/1999,10/19/1995,09:15 am,3 min.,,"fed. empl. (pilot &amp  a/c mech.) w/ 2 co-workers witness 2 metallic discs approach from e sky below contrails, turn, streak. exclnt.",vancouver,wa,45.6388889,-122.6602778
11/2/1999,10/19/1995,07:15 pm,45 sec.,,"man's dog suddenly starts acting very bizarrely, threatens to bite him.  he takes dog outside, witnesses bizarre light hover, leave.",beaverton,or,45.4872222,-122.8025
12/2/2000,10/19/2000,05:28 am,2sec,,bright light moves in 90 degree direction,waxhaw,nc,34.9244444,-80.7436111
11/2/2004,10/19/2004,08:00 pm,over 1 hr.,light,,grand island,ne,40.925,-98.3416667
10/31/2008,10/19/2008,10:30 pm,3 min,,((hoax??))  single craft rose from east quickly crossed toward west,doylestown,pa,40.31,-75.1302778
10/19/2011,10/19/2011,03:20 am,1 minute,,neon flash then a fast fading jetstream like trail,lennox,sd,43.3541667,-96.8916667
3/19/2009,10/20/1973,12:00 am,1/2 hour,,5-6 star like lights moved single file across the sky 10/20/1973,new york city,ny,40.7141667,-74.0063889
2/12/2004,10/20/1975,03:15 am,10 minutes,,large wheel of no substance flickering and copying itself.,watkins glen,ny,42.3805556,-76.8736111
10/28/2002,10/20/2002,04:00 pm,1/3 second (est.),,airline pilot calls to inquire about fox 23 video  complains that u. s. government apparently is doing nothing.,albany,ny,42.6525,-73.7566667
10/31/2003,10/20/2003,01:30 am,1hr and still going,,object hovering at top of mountain rising slowly but steady up and to the right. the object has a bright white light that stays on all,mercersburg,pa,39.8277778,-77.9036111
5/12/2009,10/20/2007,01:00 am,25 min.,,to director of ufo center,opal,wy,41.7691667,-110.3252778
10/30/2012,10/20/2012,12:30 am,90 seconds,,observed a fast moving spherical object moving horizontally across the eastern horizon.,virginia beach,va,36.8527778,-75.9783333
11/3/2005,10/21/2005,11:05 pm,4 seconds,,1 large lime green meteor like object no meteor tail. fell at an angle from northwest to southeast. much larger than other meteors i ha,canyonville,or,42.9275,-123.28
10/30/2012,10/21/2012,11:57 pm,90 seconds,,large orange ball over rhode island.,cranston,ri,41.7797222,-71.4377778
11/2/1999,10/2/1995,12:20 am,25 sec.,,"woman goes out to smoke, witnesses overhead ""something flapping its wings, like a pteradactyl.""  obj. flew nw. had blue lights.",santa rosa,ca,38.4405556,-122.7133333
11/2/1999,10/2/1995,07:50 pm,5 sec.,,"man witnesses very small, very bright light descending rapidly in ne sky.  approx. 1/10 diameter of moon.",farmington,mn,44.6402778,-93.1433333
12/23/2002,10/2/2000,11:00 pm,hour,,"lights gradually coming on, and then going off in formation.",fairbanks,ak,64.8377778,-147.7163889
10/10/2011,10/2/2011,09:00 pm,2 days,,red and green lights over marion indiana,marion,in,40.5583333,-85.6591667
11/2/1999,10/22/1995,02:30 am,15 min.,,"man, wife, 2 children,  driving down long hill, see bizarre cluster of lights, ""like christmas tree in the sky.""  multiple witnesses.",bessemer,al,33.4016667,-86.9544444
11/2/1999,10/22/1995,07:35 pm,6 sec.,,"young girl w/ friends witness bizarre ""triangle w/ 3 red, dim lights,"" streak across sky.  strobed bright light.  scared, nauseous.",auburn,ca,38.8966667,-121.0758333
12/2/2000,10/22/2000,04:30 am,15 minutes,,flashing lights around planet or star.,oshkosh,wi,44.0247222,-88.5425
11/3/2005,10/22/2005,09:10 pm,3-4 seconds,,"my name is fritz hughes, i live in little rock ar. on oct.22nd 2005 at approximately 9:10 pm cdt i was out on our back patio smoking a",little rock,ar,34.7463889,-92.2894444
11/2/1999,10/23/1995,09:30 pm,15 min.,,"young couple witness 2 ""huge"" objects pass overhead.  had no wings, 20 lights (est.) per side.  very visible  ""hummed.""  good rpt.",johnson city,tn,36.3133333,-82.3536111
12/12/2011,10/23/2011,07:05 am,5 seconds,,bright light flash,center city,tx,31.4702778,-98.4086111
10/25/2011,10/23/2011,07:05 pm,30 seconds,,redish object just kind of hovering then disappeared.,tacoma,wa,47.2530556,-122.4430556
11/2/1999,10/24/1995,02:00 am,1 min.,,"man calls to relay sighting of ""very large white light in sky.""  obj. developed ""tail like comet.""  other observers.  called police.",hollister,ca,36.8525,-121.4005556
11/2/2004,10/24/2004,11:00 pm,4 seconds,,i have a question about something that happened to me just the other night that i cant explain in the sky. ((meteor??)),zanesville,oh,39.9402778,-82.0133333
10/31/2008,10/24/2008,08:30 pm,minute,,large flame flickered across sky,gaviota,ca,34.4716667,-120.2138889
11/2/1999,10/25/1996,11:08 am,25 sec.,,"man, entering hwy. i-95, sees 2 round objs. hovering motionless in clear sky.  color of pencil lead w/ copper.  objs. streak in 1 sec.",laurel,md,39.0991667,-76.8486111
11/21/2010,10/25/2010,07:25 pm,5-10 sec,,orange light in the sky viewed form omer michigan,omer,mi,44.0475,-83.8544444
11/1/1998,10/26/1998,12:30 am,1-2 minutes,,i hung up the phone with a friend and went to bed. i had pulled the covers around my shoulders and my eyes were closed. with closed eye,marina del rey,ca,33.9802778,-118.4508333
11/28/2007,10/26/2007,12:00 am,5 seconds,,"witnessed a thin bright, white streak in the sky lasting only a few seconds  prior to ending in a white flash followed by a bright gree",oregon city,or,45.3575,-122.6055556
11/2/1999,10/27/1995,09:23 pm,15 min.,,"woman &amp  3 witnesses rpt stat. obj flashing white, green, red lights.  zigzags dramatically. (reptd. 02no95 obj. not visible in sky.)",siletz,or,44.7219444,-123.9188889
12/12/2009,10/27/2009,06:20 pm,15 min,,symbolic contrails over kaneohe that looked like squares and arcs,kaneohe,hi,21.4180556,-157.8036111
11/21/2010,10/27/2010,08:00 am,90 min.,,"looked like sattelite or star, extreme acceleration",jonesville,mi,41.9841667,-84.6619444
11/2/1999,10/28/1995,01:30 am,3 hrs.,,"man &amp  wife see very bright obj do ""loop"" then see 3 more objs.  got other witnesses, saw 11 objs! seemed to ""shoot at each other.""",greenwood,ca,38.8966667,-120.9116667
11/2/1999,10/28/1995,08:00 pm,2 sec.,,"woman repts. a ""white, round meteor,"" viewed from rte. 64.  viewed to north approx. 25 deg. above horizon.",auburn,wa,47.3075,-122.2272222
10/31/2008,10/28/2008,07:35 pm,2 minutes 10 seconds,,"formation of yellow-orange,gold orbs",phillipsburg,ks,39.7561111,-99.3236111
12/12/2009,10/28/2009,07:30 pm,2 or 3 minutes,,"2 large orange illuminating round lights moving slowly in nw sky above horizon outside of selah,wa.",selah,wa,46.6541667,-120.5288889
11/2/1999,10/29/1995,09:40 pm,30 min.,,"woman repts. ""4 lights, then 6 lights, look like bright street lights in the sky.""  criss-crossing, dancing motion. (adv. lights?)",ellisville,mo,38.5925,-90.5869444
11/2/1999,10/29/1995,09:40 pm,1 minute,,"man &amp  wife witness very bizarre obj. moving erratically in sky.  ""it looked like an airplane, but it wasn't (one.)""  1 blinking light.",kodak,tn,35.9744444,-83.6269444
12/20/2012,10/29/2012,10:30 am,seconds,,unusual alien in the window - non grey.,woonsocket,ri,42.0027778,-71.5152778
11/2/1999,10/30/1995,11:30 pm,30 min.,,"woman rpts peculiar bright obj. in nw sky, 45 deg. above horizon.  (reported 02no95 obj. was not present on subsequent nights.)",seattle,wa,47.6063889,-122.3308333
12/2/2000,10/30/2000,07:00 pm,less than one minute,,bright green light moving fast,austintown,oh,41.1016667,-80.7647222
12/12/2009,10/30/2002,01:00 am,2 minutes,,san diego ca marine air base ball of light,san diego,tx,27.7636111,-98.2386111
11/8/2003,10/30/2003,09:17 pm,2 seconds,,"while i was driving, a green light streaked so low overhead that i thought it was going to crash into the hills.",spokane,wa,47.6588889,-117.425
5/11/2000,10/31/1974,05:45 pm,about 1 minute,,"orange light different from landing aircraft at o'hare airport shot up, then to the right and then out of site in about 5 seconds.",chicago,il,41.85,-87.65
9/28/2002,10/31/1995,08:45 pm,4 min.,,"woman witnessed apparently round obj. w/ 7 lights on rim, alternating red &amp  white.  lights gave impression they were ""circling.""",startup,wa,47.8680556,-121.7391667
11/2/1999,10/31/1995,09:10 pm,4 sec.,,"man sitting in hot tub sees ""satellite"" in e sky.  obj. suddenly accelerated dramatically, made zigzag turns, departed very fast.",tacoma,wa,47.2530556,-122.4430556
11/2/1999,10/31/1995,10:05 pm,20 sec.,,"passenger in car noticed ""haze"" that appeared to be divided into 3 ""sections"" w/ bright light in center.  changed shape, became disc.",west hartford,ct,41.7636111,-72.6855556
11/2/1999,10/31/1996,02:15 am,30 sec.,,"sec. officer at hospital  sees very bright blue light.  silhouetted by cloud, appears as ""coffee table w/ shirt box on top."" erratic.",boerne,tx,29.7944444,-98.7316667
11/2/1999,10/31/1999,09:30 pm,10/15seconds,,"weather conditons were winds gusting 40/45 mph when all power went off in area, we stepped outside and immediatly nsaw 8/10 large red l",billings,mt,45.7833333,-108.5
11/2/2004,10/31/2004,07:56 pm,16 minutes,,3 very bright red lights.,matteson,il,41.5038889,-87.7130556
11/3/2005,10/31/2005,09:15 pm,few seconds,,"very bright flash with a tail seen in the night sky on oct. 31, 2005 between 21:00 and 21:30 over leesburg, va.",leesburg,va,39.1155556,-77.5638889
2/1/2007,10/31/2006,08:00 am,60 minutes,,perfect  giant circular hole in heavy clouds with a clear blue sky only within the hole.,chicago,il,41.85,-87.65
11/21/2010,10/31/2010,05:00 pm,15 minutes,,cylinder  shaped flying steady like a hawk on top of my dad's house.,roselle,il,41.9847222,-88.0797222
11/17/1999,10/3/1999,11:00 pm,1 second,,green fireball on october 3rd.,orondo,wa,47.6261111,-120.2241667
10/11/2005,10/3/2005,10:00 pm,1/2 hour +,,bright stationary red light on a partially cloudy night in an area of the sky in which no stars were visable. this was not a star/plane,lake villa,il,42.4169444,-88.0738889
11/1/1998,10/4/1998,02:45 am,1 minute +,,"very bright white light,  appeared to be about half the diameter of the moon.",albuquerque,nm,35.0844444,-106.6505556
10/19/1999,10/4/1999,07:25 pm,5 seconds,,"bright light flashed on, moved slightly to right, dissipated, light lingered briefly",tucson,az,32.2216667,-110.9258333
10/28/2002,10/5/2002,07:45 am,90 sec. arpox,,more than one saw the object over las cruces,las cruces,nm,32.3122222,-106.7777778
10/10/2011,10/5/2011,05:10 am,5 mins.,,"while walking my dog i noticed a bright orange object which i thought to be mars. however, as i was looking at it, it grew brighter, an",oakville,ct,41.5933333,-73.0858333
10/30/2012,10/5/2012,12:30 am,1 minute,,i was sitting at my computer when i saw a light flash down on the tree between me and my neighbors houses. then it happened again about,torrance,ca,33.8358333,-118.3397222
11/2/1999,10/6/1995,07:00 pm,15 min.,,"man witnesses ""small whitish, blue-green ball"" pass overhead, flying to east.",puyallup,wa,47.1855556,-122.2916667
10/30/2012,10/6/2012,12:40 am,90 seconds,,"i am a retired plychologist age 64. i sit out every night till about 2pm facing the south. i saw  a large round orange ball, like a pu",cranston,ri,41.7797222,-71.4377778
10/15/2002,10/7/2002,07:00 pm,3 seconds,,observed a meteorite travelling from north to south at a very steep (45 degrees) angle. the meteorite exploded when it neared the earth,longmont,co,40.1672222,-105.1013889
12/12/2009,10/7/2009,04:50 pm,15 seconds,,object was red and silver with no wings (cigar shaped) moving at slow jet speed.,wilkesboro,nc,36.1458333,-81.1608333
11/21/2010,10/7/2010,09:02 pm,4 seconds,,seven faint lights in a tight v formation traveling rapidly across sky and fade away.,spring hill,fl,28.5555556,-82.4505556
10/14/2013,10/7/2013,07:40 am,3 seconds,,no object seen  however while driving down  carson river road my driving lights went off on their own for approximately 3 seconds.   it,carson city,nv,39.1638889,-119.7663889
11/11/2003,10/8/2000,02:00 am,few seconds,,a bright red beam of light caught my eye and disappeared quickly as i turned to watch it.,fairfield,ia,41.0086111,-91.9625
10/10/2011,10/8/2011,09:15 pm,2.5 minutes,,bright burnt orange object moving at the speed simular to space station but bigger,peoria,il,40.6936111,-89.5888889
1/22/2004,10/9/1955,06:00 pm,4 sec,,brilliant green meteor heading north west from view in california near l.a.,west covina,ca,34.09,-117.8894444
11/20/2001,10/9/2001,06:50 pm,3-4 min,,oakland-bay bridge sighting?,emeryville,ca,37.8313889,-122.2841667
11/21/2010,10/9/2010,09:00 pm,4 min.,,"orange, flickering light in the sky moving silently and changing direction 90 degrees once before dimming out.",ocean isle beach,nc,33.8941667,-78.4269444
4/16/2005,1/10/1968,11:00 pm,three hours,,lost three hours of time--and didn't think it strange.,jacksonville,fl,30.3319444,-81.6558333
11/2/1999,1/10/1995,07:15 am,30 sec.,,"man sees seven very bright, golden lights descend from sky, hover, and move strangely. quickly  streaks to w.",riverside,ca,33.9533333,-117.3952778
7/29/2010,1/10/1996,06:50 pm,30 min.,,"father and son witness a very peculiar, multi-colored light, as it appeared to rotate.",meadville,pa,41.6413889,-80.1516667
7/23/2000,1/10/1998,10:24 pm,30 sec.,,no craft seen.  we heard a bang against the house and the bedroom blinds began turning red as if someone had backed a car up two our be,lowell,in,41.2913889,-87.4205556
1/11/2002,1/10/2002,09:30 pm,30 sec.,,"bluish-white object streaks across sky, explodes into orange fireball then falls toward earth",phoenix,az,33.4483333,-112.0733333
9/2/2005,1/10/2005,05:24 pm,20-30 sec.,,"solo driver witnesses oblong, rectangular object w/ lights moving to the north above freeway",denver,co,39.7391667,-104.9841667
11/2/1999,11/10/1995,07:50 pm,40 min.,,"family returns from restaurant and notice ""emerald green beam"" of light going horizontally over their home. beam ended abruptly.",beaverton,or,45.4872222,-122.8025
11/2/1999,11/10/1995,11:25 pm,10 sec.,,"man experienced 15 sec. power outage in enumclaw, then witnesses major blue, then green flash south of auburn. 50 deg. of sky.",auburn,wa,47.3075,-122.2272222
11/17/1999,11/10/1999,12:01 am,less than 1min,,"5-6 hi power military jets, either f15s or f18s, scrambled out of lambert field and headed south east as shifts changed at aircraft pla",st. louis,mo,38.6272222,-90.1977778
11/17/1999,11/10/1999,11:00 pm,15 min.,,"it was in the evening,when the craft came across the sky moving from left to right before going stright  and then it was gone. to conta",atlanta,ga,33.7488889,-84.3880556
12/16/2005,11/10/2005,06:00 pm,15-20 minutes,,"this is the fourth report concerning the ""lights"" i have seen in the skies near austin, texas.  ((possible spider webs??))",bastrop,tx,30.1102778,-97.315
12/12/2009,11/10/2009,08:20 am,25 minutes,,i saw blinking lights which at first looked like an aircraft except for irregularities in the sequence.  the craft looked like it was j,long beach,ca,33.7669444,-118.1883333
11/19/2012,11/10/2012,06:30 pm,50 minutes,,"multiple orange spheres over derby, ny.",derby,ny,42.6813889,-78.9755556
9/2/2005,11/11/1979,07:30 pm,1 hour +,,"hi, i reported seeing an object back in the late 70s to another site. i was struck by the similarities in the description, and the tim",wickenburg,az,33.9686111,-112.7288889
11/2/1999,11/11/1995,01:15 am,10 min.,,"three adults hear a strange noise, see a strange ""star"" to w.  obj. does gyrations, then streaks n.  10 min. later, they see 3 more.",eugene,or,44.0522222,-123.0855556
11/2/1999,11/11/1995,07:00 pm,10 min.,,"two young women driving to party encounter a large cylindrical-shaped obj. ""w/ a lot of lights on it."" drifted slowly, streaked.",solvang,ca,34.5958333,-120.1366667
11/2/1999,11/11/1995,09:45 pm,10 sec.,,"woman on cruise boat sees large obj. w/ 8-10 strange red lights, passes overhead n to s, dips, rises vert. out of sight! no sound.",kirkland,wa,47.6816667,-122.2075
11/20/2001,11/11/2001,07:00 pm,.10 sec,,when returing from hunting elk seen a green blob falling down leaving a green trail behind then it blew up and lit up the whole valley,mogote,co,37.0594444,-106.0916667
12/23/2002,11/1/1970,08:30 pm,30 min.,,a number of cases described a reddish clay residue that had been found at abduction sites.,rochester,ny,43.1547222,-77.6158333
4/16/2005,11/1/1972,07:30 pm,30 seconds,,high pitch tones were probably an encounter with a ufo in crescent city california during the early 1970s,crescent city,ca,41.7561111,-124.2005556
8/5/2009,11/1/1973,07:00 pm,3 minutes,,"no sound, very close, translucent metal with shapless orange glow in center of craft.",huntington,ny,40.8680556,-73.4261111
11/2/1999,11/1/1995,12:15 am,2 sec.,,"exp. ufo investigator, mufon member, witnesses very bright bluish/white flash of light that lit living room.  descended rapidly.",bothell,wa,47.7625,-122.2041667
8/5/2001,1/11/1996,05:58 pm,4 sec.,,"seattle ufo investigator reports witnessing a brilliantly bright, round, yellow ""ball of light"" traveling extremely fast to the north.",woodinville,wa,47.7544444,-122.1622222
1/22/2000,1/11/2000,11:15 am,5 seconds,,"i saw 3 bright flashes,light up the sky. i looked up and saw large bright windows, and red,one white, and blue lights which appeared to",brownell,ks,38.6402778,-99.7458333
11/8/2003,11/1/2003,09:15 am,10 minutes,,very strange whirring noises - about 3 minutes apart,grand junction,co,39.0638889,-108.55
1/31/2011,1/11/2011,12:00 am,3-5 seconds,,sky lit up green.,waxhaw,nc,34.9244444,-80.7436111
2/4/2013,1/11/2013,06:30 pm,30 minutes,,stationary single object seeming to be changing colors and shapes in the night sky.  ((nuforc note:  possible sighting of sirius?  pd)),plantation,fl,26.1272222,-80.2333333
1/11/2002,11/12/1991,11:00 pm,2mins,,"just got in bed saw a bright light that complety lit up entire 50 acre lake also heard loud whistle,by the time my wife and i could get",brooksville,fl,28.555,-82.3880556
11/2/1999,11/12/1995,09:00 pm,45 min.,,"woman repts. two stationary, ""colorful,"" lights to w &amp  nw of her position.  (description not inconsistent w/ twinkling stars.)",las vegas,nv,36.175,-115.1363889
